"Product ID","Published State","Purchase Type","Auto Translate","Locale; Title; Description","Auto Fill Prices","Price"
"purchase_bog","published","managed_by_android","false","en_US; Box of Goodies; Get 400 + 60(bonus) tokens to spend in Idonia!; iw_IL; קופסת Goodies; קבל 400 + 60 (בונוס) אסימונים להוציא Idonia!; ja_JP; グッズのボックス; 400 + 60（ボーナス）Idoniaに過ごすためにトークンを入手！; fr_FR; Boîte de Goodies; Obtenez 400 + 60 (bonus) des jetons à dépenser dans Idonia!; fi_FI; Box of Goodies; Hanki 400 + 60 (bonus)-tunnisteita viettää Idonia!; cs_CZ; Krabice Goodies; Získejte 400 + 60 (bonus) tokeny strávit v Idonia!; hi_IN; उपहार के बॉक्स; 400 + (बोनस) 60 Idonia में खर्च करने के लिए टोकन जाओ!; no_NO; Box of Goodies; Få 400 + 60 (bonus) tokens å tilbringe i Idonia!; es_ES; Caja de extras; Obtener 400 + 60 (bonus) fichas para gastar en Idonia!; ru_RU; Коробка Goodies; Получи 400 + 60 (бонус) маркеры, чтобы провести в Idonia!; de_DE; Box mit Extras; Holen Sie sich 400 + 60 (Bonus) Tokens bis in Idonia zu verbringen!; ko_KR; 근사한 박스; Idonia에 지출 토큰 400 + 60 (보너스)를 잡아!; it_IT; Box di Goodies; Prendi 400 + 60 (bonus) gettoni da spendere in Idonia!; pt_PT; Caixa de extras; Obter 400 + 60 (bônus) fichas para gastar em Idonia!; hu_HU; Box nyalánkság; Get 400 + 60 (bonus) tokenek tölteni Idonia!; pl_PL; Pudełko Korzyści; Zdobądź 400 + 60 (bonus) tokeny spędzić w Idonia!; sv_SE; Box of Goodies; Få 400 + 60 (bonus) polletter att spendera i Idonia!; nl_NL; Doos van Goodies; Krijg 400 + 60 (bonus) tokens te besteden in Idonia!; zh_TW; 一盒的超值服務; 送400 +60（獎金），令牌在Idonia度過！; da_DK; Æske med Goodies; Få 400 + 60 (bonus) tokens til at tilbringe i Idonia!","false","US; 20000000; BE; 16090000; AU; 20540000; SK; 16090000; NZ; 26520000; FI; 16090000; MX; 284360000; ES; 16090000; CZ; 413880000; NL; 16090000; AT; 16090000; IE; 16090000; GR; 16090000; GB; 13030000; LU; 16090000; CH; 19330000; DK; 119580000; CA; 20810000; DE; 16090000; PT; 16090000; PL; 70500000; NO; 122200000; SI; 16090000; FR; 16090000; EE; 16090000; KR; 23598000000; SG; 25760000; HK; 155170000; IT; 16090000; JP; 1565000000; IL; 77910000; SE; 144300000"
"purchase_gsog","published","managed_by_android","false","en_US; Giant Sack of Goodies; Get 1000 + 200(bonus) tokens to spend in Idonia!; iw_IL; שק ענק של Goodies; קבל 1,000 + 200 (בונוס) אסימונים להוציא Idonia!; ja_JP; グッズの巨大な袋; Idoniaに過ごすためにトークン1000 + 200（ボーナス）を取得！; fr_FR; Sack Géant de Goodies; Obtenez 1000 + 200 (bonus) des jetons à dépenser dans Idonia!; fi_FI; Giant Sack of Goodies; Hanki 1000 + 200 (bonus)-tunnisteita viettää Idonia!; cs_CZ; Obří Pytel Goodies; Získejte 1000 + 200 (bonus) tokeny strávit v Idonia!; hi_IN; उपहार की विशाल बोरी; + 1000 (बोनस) 200 Idonia में खर्च टोकन जाओ!; no_NO; Giant Sack av Goodies; Få 1000 + 200 (bonus) tokens å tilbringe i Idonia!; es_ES; Saco Gigante de extras; Consigue 1.000 + 200 (bonus) fichas para gastar en Idonia!; ru_RU; Гигантский Мешок Goodies; Получи 1000 + 200 (бонус) маркеры, чтобы провести в Idonia!; de_DE; Riesen-Sack von Extras; Holen Sie sich 1000 + 200 (Bonus) Tokens bis in Idonia zu verbringen!; ko_KR; 근사한 거대 색; Idonia에 지출 토큰 1000 + 200 (보너스)를 잡아!; it_IT; Sack gigante di Goodies; Prendi 1000 + 200 (bonus) gettoni da spendere in Idonia!; pt_PT; Sack gigante de extras; Get 1000 + 200 (bônus) fichas para gastar em Idonia!; hu_HU; Óriás Sack nyalánkság; Get 1000 + 200 (bonus) tokenek tölteni Idonia!; pl_PL; Giant Sack of Korzyści; Get 1000 + 200 (premia) tokeny spędzić w Idonia!; sv_SE; Giant Sack av godsaker; Få 1000 + 200 (bonus) polletter att spendera i Idonia!; nl_NL; Giant zak van Goodies; Krijg 1000 + 200 (bonus) tokens te besteden in Idonia!; zh_TW; 巨袋的超值服務; 送1000 +200（獎金），令牌在Idonia度過！; da_DK; Kæmpe sæk Goodies; Få 1000 + 200 (bonus) tokens til at tilbringe i Idonia!","false","US; 50000000; BE; 40230000; AU; 51350000; SK; 40230000; NZ; 66300000; FI; 40230000; MX; 710900000; ES; 40230000; CZ; 1034700000; NL; 40230000; IE; 40230000; AT; 40230000; GR; 40230000; GB; 32580000; LU; 40230000; CH; 48320000; DK; 298940000; CA; 52020000; DE; 40230000; PT; 40230000; PL; 176250000; NO; 305490000; SI; 40230000; FR; 40230000; EE; 40230000; KR; 58994000000; SG; 64410000; HK; 387920000; IT; 40230000; IL; 194790000; JP; 3913000000; SE; 360760000"
"purchase_hog","published","managed_by_android","false","en_US; Handful of Goodies; Get 20 tokens to spend in Idonia!; iw_IL; קומץ Goodies; קבל 20 אסימונים להוציא Idonia!; ja_JP; グッズのほんの一握り; Idoniaで過ごすには20トークンを入手！; fr_FR; Poignée de Goodies; Obtenez 20 jetons à dépenser dans Idonia!; fi_FI; Kourallinen Goodies; Hanki 20 rahakkeita viettää Idonia!; cs_CZ; Hrst Goodies; Získejte 20 tokeny, jak strávit v Idonia!; hi_IN; उपहार की मुट्ठी; 20 से टोकन Idonia में खर्च हो जाओ!; no_NO; Håndfull Goodies; Få 20 tokens å tilbringe i Idonia!; es_ES; Un puñado de extras; Consigue 20 fichas para gastar en Idonia!; ru_RU; Горсть Goodies; Получите 20 жетонов провести в Idonia!; de_DE; Eine Hand voll Extras; Holen Sie sich 20 Strecken in Idonia zu verbringen!; ko_KR; 근사한 소수; Idonia에 보낼 20 토큰을 잡아!; it_IT; Handful of Goodies; Prendi 20 gettoni da spendere in Idonia!; pt_PT; Punhado de extras; Obter 20 fichas para gastar em Idonia!; hu_HU; Maroknyi nyalánkságok; Get 20 tokenek tölteni Idonia!; pl_PL; Garść Korzyści; Zdobądź 20 tokenów spędzić w Idonia!; sv_SE; Handfull Goodies; Få 20 polletter att spendera i Idonia!; nl_NL; Handvol Goodies; Krijg 20 tokens te besteden in Idonia!; zh_TW; 少數超值; 得到20個令牌在Idonia度過！; da_DK; Handful over Goodies; Få 20 tokens til at bruge i Idonia!","false","US; 1000000; BE; 800000; AU; 1030000; SK; 800000; NZ; 1330000; FI; 800000; MX; 14220000; ES; 800000; CZ; 20690000; NL; 800000; AT; 800000; IE; 800000; GR; 800000; GB; 650000; LU; 800000; CH; 1000000; DK; 6000000; CA; 1040000; DE; 800000; PT; 800000; PL; 3530000; NO; 6110000; SI; 800000; FR; 800000; EE; 800000; KR; 1180000000; SG; 1290000; HK; 7760000; IT; 800000; JP; 99000000; IL; 3900000; SE; 7220000"
"purchase_mog","published","managed_by_android","false","en_US; Mouthful of Goodies; Get 100 + 5(bonus) tokens to spend in Idonia!; iw_IL; פה מלא Goodies; קבל 100 + 5 (בונוס) אסימונים להוציא Idonia!; ja_JP; グッズの一口; Idoniaに過ごすためにトークンを100 + 5（ボーナス）を取得！; fr_FR; Mouthful of Goodies; Obtenez 100 + 5 (bonus) des jetons à dépenser dans Idonia!; fi_FI; Suupala Goodies; Hanki 100 + 5 (bonus)-tunnisteita viettää Idonia!; cs_CZ; Sousto Goodies; Získejte 100 + 5 (bonus) tokeny strávit v Idonia!; hi_IN; उपहार के कौर; 100 (बोनस) 5 Idonia में खर्च टोकन जाओ!; no_NO; Munnfull av Goodies; Få 100 + 5 (bonus) tokens å tilbringe i Idonia!; es_ES; La boca llena de extras; Obtener el 100 + 5 (bono) fichas para gastar en Idonia!; ru_RU; Рот Goodies; Получите 100 + 5 (бонус) маркеры, чтобы провести в Idonia!; de_DE; Schluck Extras; Holen Sie sich 100 + 5 (Bonus) Tokens bis in Idonia zu verbringen!; ko_KR; 근사한 한입 가득; Idonia에 지출 토큰 100 + 5 (보너스)를 잡아!; it_IT; Boccata di Goodies; Prendi 100 + 5 (bonus) gettoni da spendere in Idonia!; pt_PT; Boca cheia de extras; Ganhe 100 + 5 (bônus) fichas para gastar em Idonia!; hu_HU; Falat nyalánkságok; Get 100 + 5 (bonus) tokenek tölteni Idonia!; pl_PL; Łyk Korzyści; Get 100 + 5 (bonus) tokeny spędzić w Idonia!; sv_SE; Munfull Goodies; Få 100 + 5 (bonus) polletter att spendera i Idonia!; nl_NL; Mondvol Goodies; Ontvang 100 + 5 (bonus) tokens te besteden in Idonia!; zh_TW; 滿口超值; 送100 + 5個（獎金），令牌在Idonia度過！; da_DK; Mundfuld Goodies; Få 100 + 5 (bonus) tokens til at tilbringe i Idonia!","false","US; 5000000; BE; 4020000; AU; 5130000; SK; 4020000; NZ; 6630000; FI; 4020000; CZ; 103470000; MX; 71090000; ES; 4020000; NL; 4020000; AT; 4020000; IE; 4020000; GR; 4020000; GB; 3260000; LU; 4020000; CH; 4830000; DK; 29890000; CA; 5200000; DE; 4020000; PT; 4020000; PL; 17630000; NO; 30550000; SI; 4020000; FR; 4020000; EE; 4020000; KR; 5899000000; SG; 6440000; HK; 38790000; IT; 4020000; SE; 36080000; JP; 391000000; IL; 19480000"
"purchase_msog","published","managed_by_android","false","en_US; Massive Sack of Goodies; Get 2000 + 1000(bonus) tokens to spend in Idonia!; iw_IL; שק ענק של Goodies; קבל 2000 + 1000 (בונוס) אסימונים להוציא Idonia!; ja_JP; グッズの大規模なサック; Idoniaに過ごすためにトークン2000 + 1000（ボーナス）を取得！; fr_FR; Sack massive de Goodies; Obtenez 2000 + 1000 (bonus) des jetons à dépenser dans Idonia!; fi_FI; Massive Sack of Goodies; Hanki 2000 + 1000 (bonus)-tunnisteita viettää Idonia!; cs_CZ; Masivní Pytel Goodies; Získejte 2000 + 1000 (bonus) tokeny strávit v Idonia!; hi_IN; माल की भारी बोरी; 2000 + (बोनस) 1000 Idonia में खर्च टोकन जाओ!; no_NO; Massive Sack av Goodies; Få 2000 + 1000 (bonus) tokens å tilbringe i Idonia!; es_ES; Saqueo masivo de extras; Consigue 2000 + 1000 (bono) fichas para gastar en Idonia!; ru_RU; Массивные Мешок Goodies; Получи 2000 + 1000 (бонус) маркеры, чтобы провести в Idonia!; de_DE; Massiver Sack voller Goodies; Holen Sie sich 2000 + 1000 (Bonus) Tokens bis in Idonia zu verbringen!; ko_KR; 근사한 대규모 색; Idonia에 지출 토큰 2000 + 1000 (보너스)를 잡아!; it_IT; Sacco di Massive Goodies; Prendi 2000 + 1000 (bonus) gettoni da spendere in Idonia!; pt_PT; Sack maciça de extras; Get 2000 + 1000 (bônus) fichas para gastar em Idonia!; hu_HU; Massive Sack nyalánkság; Get 2000 + 1000 (bonus) tokenek tölteni Idonia!; pl_PL; Masywna Sack of Korzyści; Get 2000 + 1000 (bonus) tokeny spędzić w Idonia!; sv_SE; Massive Sack av godsaker; Få 2000 + 1000 (bonus) polletter att spendera i Idonia!; nl_NL; Massive zak van Goodies; Krijg 2000 + 1000 (bonus) tokens te besteden in Idonia!; zh_TW; 大規模的超值袋; 送2000 +1000（獎金），令牌在Idonia度過！; da_DK; Massive Sack af Goodies; Få 2000 + 1000 (bonus) tokens til at tilbringe i Idonia!","false","US; 100000000; AU; 102690000; BE; 80450000; SK; 80450000; NZ; 132610000; FI; 80450000; MX; 1421800000; ES; 80450000; CZ; 2069400000; NL; 80450000; IE; 80450000; AT; 80450000; GR; 80450000; GB; 65170000; LU; 80450000; CH; 96630000; DK; 597880000; CA; 104030000; DE; 80450000; PT; 80450000; PL; 352500000; NO; 610980000; SI; 80450000; FR; 80450000; EE; 80450000; KR; 117988000000; SG; 128820000; HK; 775840000; IT; 80450000; IL; 389570000; JP; 7825000000; SE; 721510000"
"purchase_sbog","published","managed_by_android","false","en_US; Small Bag of Goodies; Get 200 + 20(bonus) tokens to spend in Idonia!; iw_IL; תיק קטן של דברים טובים; קבל 200 + 20 (בונוס) אסימונים להוציא Idonia!; ja_JP; グッズの小さなバッグ; 200 + 20（ボーナス）Idoniaに過ごすためにトークンを入手！; fr_FR; Petit sac de sucreries; Faites-vous 200 + 20 (bonus) des jetons à dépenser dans Idonia!; fi_FI; Small Bag of Goodies; Hanki 200 + 20 (bonus)-tunnisteita viettää Idonia!; cs_CZ; Malá taška z Goodies; Získejte 200 + 20 (bonus) tokeny strávit v Idonia!; hi_IN; उपहार की लघु थैला; जाओ 200 + 20 (बोनस) Idonia में खर्च टोकन!; no_NO; Liten pose med godsaker; Få 200 + 20 (bonus) tokens å tilbringe i Idonia!; es_ES; Bolso pequeño de los extras; Consigue 200 + 20 (bonus) fichas para gastar en Idonia!; ru_RU; Сумка из Goodies; Взять 200 + 20 (бонус) маркеры провести в Idonia!; de_DE; Kleine Tasche der Sachen; 200 + 20 (Bonus)-Token erhalten, in Idonia zu verbringen!; ko_KR; 근사한 소형 가방; 200 + 20 (보너스) Idonia에 지출 토큰 받으십시오!; it_IT; Sacchetto di Goodies; Ricevi 200 + 20 (bonus) gettoni da spendere in Idonia!; pt_PT; Saco pequeno de extras; Seja 200 + 20 (bônus) fichas para gastar em Idonia!; hu_HU; Kis táska nyalánkság; Get 200 + 20 (bonus) tokenek tölteni Idonia!; pl_PL; Mała torba z Korzyści; Get 200 + 20 (bonus) tokeny spędzić w Idonia!; sv_SE; Liten påse med godsaker; Få 200 + 20 (bonus) polletter att spendera i Idonia!; nl_NL; Kleine Bag of Goodies; Ontvang een 200 + 20 (bonus) tokens te besteden in Idonia!; zh_TW; 好吃的東西的小袋子; 得到200 + 20（獎金）令牌在Idonia度過！; da_DK; Lille Pose Goodies; Få 200 + 20 (bonus) tokens til at tilbringe i Idonia!","false","US; 10000000; BE; 8050000; AU; 10270000; SK; 8050000; NZ; 13260000; FI; 8050000; MX; 142180000; ES; 8050000; CZ; 206940000; NL; 8050000; IE; 8050000; AT; 8050000; GR; 8050000; GB; 6520000; LU; 8050000; CH; 9660000; DK; 59790000; CA; 10400000; DE; 8050000; PT; 8050000; PL; 35250000; NO; 61100000; SI; 8050000; FR; 8050000; EE; 8050000; KR; 11799000000; SG; 12880000; HK; 77580000; IT; 8050000; IL; 38960000; JP; 783000000; SE; 72150000"
